{
  "$schema": "https://observability-placement.local/contracts/multisut-construction-registry.schema.json",
  "schemaVersion": 1,
  "permissions": {
    "runtimeAllowed": false,
    "externalMutationAllowed": false,
    "heldOutOutcomeAccessAllowed": false,
    "aiSelectorAllowed": false,
    "evidencePromotionAllowed": false
  },
  "transition": {
    "parentCommit": "bb29cfb068224173fe05a58a3fd750988f0de004",
    "parentTree": "034303c37785e29ea5ea6595c18b6411d55525ff",
    "ownedPaths": [
      "contracts/multisut-construction-control.schema.json",
      "contracts/multisut-construction-registry.json",
      "contracts/multisut-construction-registry.schema.json",
      "tests/test_multisut_construction.py",
      "tests/test_openspec_construction.py",
      "tests/test_science_epoch_router.py",
      "tests/test_science_epoch_router_v3.py",
      "tools/run_openspec.py",
      "tools/validate_multisut_construction.py",
      "tools/validate_science_epochs_v3.py"
    ],
    "commitDerivation": "single-commit-last-change-of-every-owned-path"
  },
  "baseEpoch": {
    "id": "teastore-construction-v2",
    "commit": "bb29cfb068224173fe05a58a3fd750988f0de004",
    "tree": "034303c37785e29ea5ea6595c18b6411d55525ff",
    "router": {
      "path": "tools/validate_science_epochs.py",
      "sha256": "bc30b5e7679450d5e6ae10382f1dc31691ee795374e8f2531409792ac7e2ad57"
    },
    "activeChangeIds": [
      "adopt-scientific-openspec",
      "adopt-teastore-diagnostic-harness",
      "phase2-method-freeze",
      "teastore-candidate-pilot-freeze"
    ]
  },
  "children": [
    {
      "changeId": "adopt-hotel-reservation-candidate-harness",
      "required": false,
      "parentEpoch": {
        "changeId": "adopt-teastore-diagnostic-harness",
        "commit": "bb29cfb068224173fe05a58a3fd750988f0de004",
        "tree": "034303c37785e29ea5ea6595c18b6411d55525ff"
      },
      "adoptedSource": {
        "kind": "candidate-construction-source",
        "commit": "40515d78551ac5abd26c8efe8aaeaa578bff4b46",
        "tree": "16ee75850c4560b019e6c529114adc8487a5a31a",
        "qualification": "local-construction-only"
      },
      "module": {
        "id": "hotel-reservation",
        "applicationFamily": "deathstarbench-hotel-reservation",
        "channel": "compose-jaeger",
        "replicationContribution": "application-family"
      },
      "blockers": [
        "runtime-adapter-absent-by-design",
        "source-off-and-selected-postures-unsupported",
        "native-operation-ground-truth-unqualified"
      ],
      "sourceBindings": [
        {
          "path": "research/five-module-readiness.json",
          "sourceCommit": "bb29cfb068224173fe05a58a3fd750988f0de004",
          "sha256": "01d49af9060e8afd892c2b8c921ea2f1082169c86107bcc520cfe82c28389091",
          "role": "digest-bound current cross-SUT evidence ceiling",
          "qualification": "reviewed-parent"
        },
        {
          "path": "modules/hotel-reservation/README.md",
          "sourceCommit": "bb29cfb068224173fe05a58a3fd750988f0de004",
          "sha256": "c3d25b7c9c56ff62454c4672a1061f1f66a7233eee2bd631373f8c98a5e864d0",
          "role": "current HotelReservation module boundary",
          "qualification": "reviewed-parent"
        },
        {
          "path": "modules/hotel-reservation/execution/candidate_pilot.py",
          "sourceCommit": "40515d78551ac5abd26c8efe8aaeaa578bff4b46",
          "sha256": "5d56a592b7e723feb7904d9c1b757bd3788fc7c25e5b4e47e8ae3502971c8045",
          "role": "pure HotelReservation candidate compiler",
          "qualification": "local-construction-source"
        },
        {
          "path": "modules/hotel-reservation/extension-ledger.yaml",
          "sourceCommit": "40515d78551ac5abd26c8efe8aaeaa578bff4b46",
          "sha256": "fb9655fb4f26cd7b77df8b003b63a734b5c1ad5be0ac69c1b2fa4b5457010c78",
          "role": "classified HotelReservation extension inventory",
          "qualification": "local-construction-source"
        },
        {
          "path": "pipelines/campaigns/hotel-reservation-candidate-pilot-v1.json",
          "sourceCommit": "40515d78551ac5abd26c8efe8aaeaa578bff4b46",
          "sha256": "ce55469004ac6ecc5d1ad75aa18b5a0e2ee7dff740b345f9e0466c0efda21563",
          "role": "exact HotelReservation candidate descriptor",
          "qualification": "local-construction-source"
        },
        {
          "path": "tests/test_hotel_candidate_pilot.py",
          "sourceCommit": "40515d78551ac5abd26c8efe8aaeaa578bff4b46",
          "sha256": "f8c84b97e7420ef4f59687eac1d7d40f557d01c5f9de65c328415938e8584805",
          "role": "HotelReservation planted-defect construction checks",
          "qualification": "local-construction-source"
        }
      ],
      "artifactBindings": [
        {
          "path": "openspec/changes/adopt-hotel-reservation-candidate-harness/.openspec.yaml",
          "sha256": "ade0c3371aaa1a8f17a3467c8dcb6c441828c74cd170b88d58dec4183a9c144d",
          "mode": "100644"
        },
        {
          "path": "openspec/changes/adopt-hotel-reservation-candidate-harness/authority.md",
          "sha256": "48c334458562923e8a65c439a9352b26f5aae21cac2e85215358ddabcddae1ed",
          "mode": "100644"
        },
        {
          "path": "openspec/changes/adopt-hotel-reservation-candidate-harness/design.md",
          "sha256": "46108f0e244a7b45154103248ee5608c2e46a571ee0e0dede3ae03df1c94effd",
          "mode": "100644"
        },
        {
          "path": "openspec/changes/adopt-hotel-reservation-candidate-harness/governance.json",
          "sha256": "337caf5f49f973e1aea65c93a44327bfeb364e85bcfd403d48cea3769e317567",
          "mode": "100644"
        },
        {
          "path": "openspec/changes/adopt-hotel-reservation-candidate-harness/proposal.md",
          "sha256": "0872ad7d3e2eb977916a44bb64d65ebee8ae30894f0fde68ef340f0ee49bf9cd",
          "mode": "100644"
        },
        {
          "path": "openspec/changes/adopt-hotel-reservation-candidate-harness/specs/adopt-hotel-reservation-candidate-harness/spec.md",
          "sha256": "d9512feca27b421a63348cae428a1046c42ccae0219167e546064dda8dac04ae",
          "mode": "100644"
        },
        {
          "path": "openspec/changes/adopt-hotel-reservation-candidate-harness/tasks.md",
          "sha256": "0d86f3214e1d0a6412ebe92065fa5535befd93d773f1ddc164ba02b233721029",
          "mode": "100644"
        },
        {
          "path": "openspec/changes/adopt-hotel-reservation-candidate-harness/verification.md",
          "sha256": "c76e3419ae6c68311ed4f0ccb46f5f66e04362e68e5cf5647018aa19fb376112",
          "mode": "100644"
        }
      ],
      "protocolBindings": {
        "studyEpoch": "hotel-reservation-candidate-pilot-v1",
        "descriptor": {
          "path": "pipelines/campaigns/hotel-reservation-candidate-pilot-v1.json",
          "byteSha256": "ce55469004ac6ecc5d1ad75aa18b5a0e2ee7dff740b345f9e0466c0efda21563",
          "canonicalSha256": "050a8677166d4af61b92155f004084455c654deb08695b6b4b5abcd6f307c8e6"
        },
        "compiler": {
          "path": "modules/hotel-reservation/execution/candidate_pilot.py",
          "sha256": "5d56a592b7e723feb7904d9c1b757bd3788fc7c25e5b4e47e8ae3502971c8045",
          "api": "pure-candidate-construction-v1"
        },
        "compiledPlan": {
          "canonicalSha256": "9877376014b7fcd6fb2fc8f5b25b4e3e9bcae00884e49f5437923520deb2c484",
          "runCount": 24
        },
        "maximumFutureRunEvidenceLabel": "candidate-evidence",
        "canonical": false
      },
      "allowedPaths": [
        "findings/adopt-hotel-reservation-candidate-harness.csv",
        "modules/hotel-reservation/execution/candidate_pilot.py",
        "modules/hotel-reservation/extension-ledger.yaml",
        "openspec/changes/adopt-hotel-reservation-candidate-harness/.openspec.yaml",
        "openspec/changes/adopt-hotel-reservation-candidate-harness/authority.md",
        "openspec/changes/adopt-hotel-reservation-candidate-harness/design.md",
        "openspec/changes/adopt-hotel-reservation-candidate-harness/governance.json",
        "openspec/changes/adopt-hotel-reservation-candidate-harness/proposal.md",
        "openspec/changes/adopt-hotel-reservation-candidate-harness/specs/adopt-hotel-reservation-candidate-harness/spec.md",
        "openspec/changes/adopt-hotel-reservation-candidate-harness/tasks.md",
        "openspec/changes/adopt-hotel-reservation-candidate-harness/verification.md",
        "pipelines/campaigns/hotel-reservation-candidate-pilot-v1.json",
        "tests/test_hotel_candidate_pilot.py"
      ]
    },
    {
      "changeId": "adopt-online-boutique-candidate-harness",
      "required": false,
      "parentEpoch": {
        "changeId": "adopt-teastore-diagnostic-harness",
        "commit": "bb29cfb068224173fe05a58a3fd750988f0de004",
        "tree": "034303c37785e29ea5ea6595c18b6411d55525ff"
      },
      "adoptedSource": {
        "kind": "candidate-construction-source",
        "commit": "e84cd1538363f5640c68bdf98cfb3047fa705531",
        "tree": "9e2e3d7d1a8fe95b4dcf40266423c5c2259b727d",
        "qualification": "local-construction-only"
      },
      "module": {
        "id": "online-boutique",
        "applicationFamily": "google-online-boutique",
        "channel": "compose-native-otel",
        "replicationContribution": "application-family"
      },
      "blockers": [
        "request-trace-correlation-not-implemented",
        "runtime-readiness-not-implemented"
      ],
      "sourceBindings": [
        {
          "path": "research/five-module-readiness.json",
          "sourceCommit": "bb29cfb068224173fe05a58a3fd750988f0de004",
          "sha256": "01d49af9060e8afd892c2b8c921ea2f1082169c86107bcc520cfe82c28389091",
          "role": "digest-bound current cross-SUT evidence ceiling",
          "qualification": "reviewed-parent"
        },
        {
          "path": "modules/online-boutique/README.md",